<?xml version="1.0" encoding="UTF-8"?>
<!DOCTYPE universe SYSTEM "doctypes/dtdUniverse.dtd">
<universe version="1.0">
    <content>
        <background type="color" src="texture1.png">
            1, 1, 1
        </background>
        <limits width="8" height="5" deepness="6" thickness="0.01">
            <appearance>
               <!--<material>
                    <ambient>1,0,1</ambient>
                    <emissive>0, 0, 0</emissive>
                    <diffuse>0.37, 0.37, 0.37</diffuse>
                    <specular>0.89, 0.89, 0.89</specular>
                    <shininess>1</shininess>
                 </material>-->
               <texture src="texture3.jpg"/>
            </appearance>
        </limits>
        <light type="ambient">
            <color>1, 0, 0</color>
        </light>
        <light type="directional">
            <color>1, 0, 1</color>
            <position>0, 0, 0</position>
        </light>
        <light type="point">
            <color>0, 1, 1</color>
            <position>0, 0, 0</position>
            <atenuation>1, 0, 0</atenuation>
        </light>
        <object src="arm.xml" id="2" type="arm" scale='0.005'>
            <objPos>3, 0, 0</objPos>
            <angles>12, 34, 62</angles>
        </object>
        <object src="designs/Flecha.dae" id="3" type='furniture' scale="0.04">
            <objPos>1, 1, 1</objPos>
        </object>
    </content>
</universe>